{
  "$schema": "https://hyperframes.local/schemas/asset-manifest.schema.json",
  "schemaVersion": "1.0.0",
  "revision": 1,
  "assetRevision": "assets-1",
  "status": "draft",
  "designRevision": "design-1",
  "lookRevision": "look-1",
  "designSystemDigest": null,
  "lookProfileDigest": null,
  "assetPlanDigest": null,
  "selectedAssetPlanDigest": null,
  "acceptance": { "anchorDigest": null, "representativeDigest": null, "anchorIdentity": null, "representativeIdentity": null, "batches": [] },
  "assets": [],
  "integrity": { "digest": null, "upstream": {} }
}
